Vkontakte,,,,
Name,URL,Description,Cost,Details
Bellingcat VK Scraper,https://github.com/bellingcat/vk-url-scraper,Github - scrape data, and especially media links like videos and photos, from vk.com URLs.,Free,
FindClone,https://findclone.ru/,Searches images from VK profiles (within certain limits),Free,
Search4Faces,https://search4faces.com,Upload a facepic, find similar on VKontakte, Odnoklassniki, TikTok, Clubhouse),Free,
Vk.watch,http://vk.watch/,See public comments left by an account, profile photos used, and very basic facial recognition,Free,